{
  "report": {
    "customer": "ООО «Пример»",
    "project_name": "Внедрение складского учета",
    "customer_pm": "Иванов Иван",
    "contract_basis": "Договор № 001 от 01.09.2026",
    "additional_agreement": "ДС № 1 от 01.09.2026",
    "report_number": 1,
    "contractor_pm": "Петров Петр",
    "report_date": "2026-09-21",
    "reporting_period": "01.09.2026–21.09.2026",
    "planned_stage_period": "01.09.2026–30.09.2026",
    "actual_stage_period": "Работы продолжаются",
    "stage_name": "Моделирование",
    "overall_status_points": [
      "Этап моделирования находится в работе.",
      "Демонстрационный контур развернут и используется для проверки целевых процессов.",
      "Часть проектных решений направлена Заказчику на согласование.",
      "Критического отклонения от договорного срока на дату отчета не зафиксировано.",
      "Авансовый платеж подтвержден; срок окончательного платежа не наступил.",
      "Основная зависимость — своевременное согласование проектных решений Заказчиком."
    ],
    "risk_summary": "Главный риск периода — задержка согласования проектных решений, которая может сместить завершение моделирования. До следующего контрольного срока критично получить консолидированные замечания Заказчика.",
    "financial_observation": "Факт поступления аванса подтвержден ответственным участником проекта; дата банковской операции в материалах отчета отсутствует.",
    "next_control_milestone": "завершение согласования целевой модели — 23.09.2026; завершение моделирования — 30.09.2026.",
    "field_sources": {
      "customer": [
        "src-ds"
      ],
      "contract_basis": [
        "src-contract"
      ],
      "additional_agreement": [
        "src-ds"
      ]
    }
  },
  "approved_budget": 100000,
  "stages": [
    {
      "id": "S1",
      "parent_id": null,
      "baseline_kind": "contract_stage",
      "plan_source_type": "additional_agreement",
      "date_basis": "explicit",
      "contract_parent_id": null,
      "contract_reference": "Приложение к ДС № 1, этап S1",
      "title": "Подготовка контура",
      "result": null,
      "owner": "Исполнитель",
      "status": "Выполнено",
      "budget": 20000,
      "duration": "3 раб. дня",
      "planned_start": "2026-09-01",
      "planned_end": "2026-09-03",
      "actual_end": "2026-09-03",
      "comment": "Контур подготовлен.",
      "requires_confirmation": false,
      "sources": [
        "src-ds",
        "src-tracker"
      ]
    },
    {
      "id": "S2",
      "parent_id": null,
      "baseline_kind": "contract_stage",
      "plan_source_type": "additional_agreement",
      "date_basis": "explicit",
      "contract_parent_id": null,
      "contract_reference": "Приложение к ДС № 1, этап S2",
      "title": "Проработка целевой модели",
      "result": null,
      "owner": "Исполнитель",
      "status": "На согласовании",
      "budget": 30000,
      "duration": "7 раб. дней",
      "planned_start": "2026-09-04",
      "planned_end": "2026-09-12",
      "actual_end": null,
      "comment": "Материалы направлены на согласование.",
      "requires_confirmation": false,
      "sources": [
        "src-ds",
        "src-tracker"
      ]
    },
    {
      "id": "S3",
      "parent_id": null,
      "baseline_kind": "contract_stage",
      "plan_source_type": "additional_agreement",
      "date_basis": "explicit",
      "contract_parent_id": null,
      "contract_reference": "Приложение к ДС № 1, этап S3",
      "title": "Моделирование процессов",
      "result": null,
      "owner": "Исполнитель",
      "status": "В работе",
      "budget": 50000,
      "duration": "10 раб. дней",
      "planned_start": "2026-09-13",
      "planned_end": "2026-09-30",
      "actual_end": null,
      "comment": "Работы продолжаются.",
      "requires_confirmation": false,
      "sources": [
        "src-ds",
        "src-chat"
      ]
    }
  ],
  "tasks": [],
  "operational_items": [
    {
      "id": "1.1",
      "parent_id": "S1",
      "baseline_kind": "operational",
      "plan_source_type": "other",
      "title": "Развернуть тестовый контур",
      "result": "Рабочий тестовый контур",
      "owner": "Исполнитель",
      "status": "Выполнено",
      "budget": null,
      "duration": null,
      "planned_start": "2026-09-01",
      "planned_end": "2026-09-03",
      "actual_end": "2026-09-03",
      "comment": null,
      "requires_confirmation": false,
      "sources": [
        "src-tracker"
      ]
    },
    {
      "id": "2.1",
      "parent_id": "S2",
      "baseline_kind": "operational",
      "plan_source_type": "other",
      "title": "Подготовить описание процесса приемки",
      "result": "Описание целевого процесса",
      "owner": "Исполнитель",
      "status": "На согласовании",
      "budget": null,
      "duration": null,
      "planned_start": "2026-09-04",
      "planned_end": "2026-09-10",
      "actual_end": null,
      "comment": "Ожидаются замечания Заказчика.",
      "requires_confirmation": false,
      "sources": [
        "src-tracker"
      ]
    },
    {
      "id": "3.1",
      "parent_id": "S3",
      "baseline_kind": "operational",
      "plan_source_type": "other",
      "title": "Проверить контрольный сценарий",
      "result": "Протокол тестового прохождения",
      "owner": "Исполнитель",
      "status": "В работе",
      "budget": 999999,
      "duration": null,
      "planned_start": "2026-09-20",
      "planned_end": "2026-09-25",
      "actual_end": null,
      "comment": "Случайно указанная стоимость operational item не входит в расчет.",
      "requires_confirmation": false,
      "sources": [
        "src-tracker"
      ]
    }
  ],
  "payments": [
    {
      "id": "PAY-ADVANCE",
      "name": "Аванс 50%",
      "amount": 50000,
      "percentage": 50,
      "plan_basis": "5 рабочих дней с даты счета",
      "planned_date": "2026-09-05",
      "actual_text": null,
      "actual_date": null,
      "status": "Подтвержден",
      "fact_evidence_level": "project_confirmed",
      "requires_confirmation": false,
      "sources": [
        "src-chat"
      ]
    },
    {
      "id": "PAY-FINAL",
      "name": "Окончательный платеж 50%",
      "amount": 50000,
      "percentage": 50,
      "plan_basis": "5 рабочих дней после подписания акта",
      "planned_date": "2026-10-10",
      "actual_text": null,
      "actual_date": null,
      "status": "Не наступил срок",
      "fact_evidence_level": "missing",
      "requires_confirmation": false,
      "sources": [
        "src-ds"
      ]
    }
  ],
  "risks": [
    {
      "id": "R01",
      "date": "2026-09-18",
      "type": "РИСК",
      "title": "Задержка согласования проектных решений",
      "probability_or_fact": "Средняя",
      "impact_degree": "Средняя",
      "impact": "Возможен сдвиг последующих работ.",
      "actions": "Получить консолидированные замечания Заказчика.",
      "result": null,
      "status": "Открыт",
      "related_task_ids": [
        "S2"
      ],
      "related_open_item_ids": [
        "Q01"
      ],
      "materiality": "medium",
      "sources": [
        "src-chat"
      ]
    }
  ],
  "health_check": [
    {
      "number": 1,
      "question": "Изменился состав и границы задач?",
      "answer": "Нет",
      "comment": "Изменений договорного объема не зафиксировано.",
      "sources": [
        "src-ds"
      ]
    },
    {
      "number": 2,
      "question": "Есть отклонение от плановых сроков?",
      "answer": "Нет",
      "comment": "Критических отклонений не зафиксировано.",
      "sources": [
        "src-tracker"
      ]
    },
    {
      "number": 3,
      "question": "Есть проблемы планирования работ?",
      "answer": "Нет",
      "comment": null,
      "sources": []
    },
    {
      "number": 4,
      "question": "Есть организационные проблемы?",
      "answer": "Нет",
      "comment": null,
      "sources": []
    },
    {
      "number": 5,
      "question": "Есть технические проблемы?",
      "answer": "Нет",
      "comment": null,
      "sources": []
    },
    {
      "number": 6,
      "question": "Есть проблемы согласования / утверждения документов?",
      "answer": "Да",
      "comment": "Часть материалов находится на согласовании.",
      "sources": [
        "src-tracker"
      ]
    },
    {
      "number": 7,
      "question": "Есть открытые риски проекта?",
      "answer": "Да",
      "comment": "Есть один открытый риск согласования.",
      "sources": [
        "src-chat"
      ]
    }
  ],
  "open_items": [
    {
      "id": "Q01",
      "priority": "medium",
      "item": "Согласовать описание процесса приемки",
      "required_action": "Передать консолидированные замечания",
      "owner": "Заказчик",
      "due_date": "2026-09-23",
      "status": "Открыт",
      "sources": [
        "src-tracker"
      ]
    }
  ],
  "sources": [
    {
      "id": "src-contract",
      "type": "contract",
      "name": "Договор № 001",
      "date": "2026-09-01",
      "reference": "основной текст",
      "note": "Основание проекта",
      "confidence": "confirmed"
    },
    {
      "id": "src-ds",
      "type": "additional_agreement",
      "name": "ДС № 1",
      "date": "2026-09-01",
      "reference": "приложение с календарным планом",
      "note": "Бюджет, сроки, оплаты",
      "confidence": "confirmed"
    },
    {
      "id": "src-bank",
      "type": "payment",
      "name": "Платежное подтверждение",
      "date": "2026-09-04",
      "reference": "операция 123",
      "note": "Аванс",
      "confidence": "confirmed"
    },
    {
      "id": "src-tracker",
      "type": "task_tracker",
      "name": "План проекта",
      "date": "2026-09-21",
      "reference": "актуальная выгрузка",
      "note": "Статусы задач",
      "confidence": "confirmed"
    },
    {
      "id": "src-chat",
      "type": "chat",
      "name": "Проектный чат",
      "date": "2026-09-18",
      "reference": "сообщение о сроках согласования",
      "note": "Рабочая информация",
      "confidence": "provisional"
    }